Canonical DBN Name,Omeka Parish Name,Variant Names,Current WCPC Name,MoEML Name,1st Year Found,Millar 1st Year,Post-Fire Parishes,Bills Subunit,Foundation Year,Notes
St Paul Covent Garden,St Paul Covent Garden,,St Paul Covent Garden,St. Paul’s (Covent Garden),"before 1625, not in 1636 bod bills, or 1641 general bill",1657,x,Westminster out parishes,1645,previously part of St Martin in the Fields
St Martin in the Fields,St Martin in the fields,,St Martin in the Fields,St. Martin in the Fields,1603,1657,x,Westminster out parishes,,"four ""daughter parishes"" broke off over time; listed as part of Middlesex/Surrey in one BL bill?"
St Mary Savoy,St Mary Savoy,The Precinct of the Savoy; St Mary Savoy in the Strand; St John Baptist Savoy,St John Baptist Savoy,,before 1625,1657,x,Westminster out parishes,,medieval; St Mary le Strand merged with it for part of this time period
St Mary le Strand,St Mary le Strand,,St Mary le Strand,St. Mary le Strand,1726,1726,,Westminster out parishes,1714/1723,"pulled down 1549, de facto merged with St Clement Danes then Savoy Chapel / St Mary Savoy until 1714-1723. Use only when distinct from St Mary Savoy. "
St Margaret Westminster,St Margaret Westminster,,St Margaret Westminster,St Margaret’s (Westminster),"before 1625, segregated from city totals in 1641",1660,x,Westminster out parishes,,split into St Margaret and St John's in 1727
Westminster Pesthouse,Pesthouse in Westminster,,,,1603,1660,x,Westminster out parishes,,
,,,,,,,,,,
,Canonical Name List Options:,https://www.londonparishclerks.com/Parishes-Churches/Parish-List,,,,,,,,
,,https://mapoflondon.uvic.ca/mdtEncyclopediaLocationParish.htm,,,,,,,,
,,"our own variant of the list (if so, need cross-walks to both)",,,,,,,,
,,,,,,,,,,
,Note: some of the Westminer parishes appear to have been recorded variously with respect to the London bills,,,,,,,,,
,,,,,,,,,,
,This possible-parish is breaking my brain,,,,,,,,,
,Nicholas Willows 1582 Bill:,https://books.google.com/books?id=s_88AQAAIAAJ&pg=PA522&lpg=PA522&dq=%22Nicholas+Willows%22+London&source=bl&ots=e2SkiLSEGI&sig=ACfU3U0iEQ684mrIjxD6h4scNRvRp2p4cA&hl=en&sa=X&ved=2ahUKEwiUqZWm0vH1AhXyhHIEHeODDQUQ6AF6BAgZEAM#v=onepage&q=%22Nicholas%20Willows%22%20London&f=false,,,,,,,will from 1601 describes man from St. Nicholas Willows in Breadstreet who is part of the parish of St. Lawrence Pountney,
,,https://books.google.com/books?id=BBwEAAAAYAAJ&pg=PA115&lpg=PA115&dq=%22Nicholas+Willows%22+London&source=bl&ots=rfI1my4a-v&sig=ACfU3U0lUDA5HxWR5w0OPMeXXdzG99wX1w&hl=en&sa=X&ved=2ahUKEwiUqZWm0vH1AhXyhHIEHeODDQUQ6AF6BAgCEAM#v=onepage&q=%22Nicholas%20Willows%22&f=false,,,,,,,reference to another book didn't look for,
,,https://www.british-history.ac.uk/camden-misc/vol12/no1/pp17-27,,,,,,,reference to it as possibly a parish in Edward's reign,
,,https://londonparishclerks.smugmug.com/Parishes-Churches/Individual-Parish-Info/St-Nicholas-Olave,,,,,,,"Nicholas Olave was on Breadstreet Hill and I found a reference to a Nicholas merging with an Olave Breadstreet (or Olave Broadstreet? argh?) in 13th century, I think this is it",
,,"ok St Olave Broad Street =/= St Olave Bread Street, yikes: https://books.google.com/books?id=N0uzxCiVHIEC&pg=PA55&lpg=PA55&dq=austin+friars+olave+breadstreet&source=bl&ots=qmAAKx5QXq&sig=ACfU3U3HBe7on1YqGFWgmt3QuZuskTKZ3w&hl=en&sa=X&ved=2ahUKEwjSwNfA1vH1AhVtoHIEHfrdDfAQ6AF6BAgTEAM#v=onepage&q=austin%20friars%20olave%20breadstreet&f=false",,,,,,,,
,,,,,,,,,,
,St Mary Axe demolished in 1561 and united to St Andrew Undershaft,,,,,,,,,
